,main_body_mid,main_body_uid,发布时间,处理内容,mid,回复数量,点赞数量,原生内容,uid,用户昵称,用户主页,用户描述,用户地理位置,用户性别,用户粉丝数量,用户关注数量,用户全部微博,用户累计评论,用户累计转发,用户累计获赞,用户转评赞,用户认证信息
0,4541027509077562,1838632051,20年08月23日 10:30,这件事情处理好了，就是让学校树立正面形象扬名全国，处理不好就是臭名千里。这种事不是福大这个学校第一次经历的，这次就看你们学校的危机公关怎么处理了。而且换个角度想，曝光有个好处，就是起码在校学生都知道，他们将来有个这样的反社会人格人做同学甚至是舍友，不恐怖吗？提前做好警惕准备挺好。,4541031880595363,1,24,这件事情处理好了，就是让学校树立正面形象扬名全国，处理不好就是臭名千里。这种事不是福大这个学校第一次经历的，这次就看你们学校的危机公关怎么处理了。而且换个角度想，曝光有个好处，就是起码在校学生都知道，他们将来有个这样的反社会人格人做同学甚至是舍友，不恐怖吗？提前做好警惕准备挺好。,5799636720,拖延症首席清除师,https://weibo.com/u/5799636720,人活着是为了证明，我们除了自己成为不了任何人。,广西,f,126,138,81,51,2,75,128,
1,4541027509077562,1838632051,20年08月23日 10:57,很多理智的网友都是希望以这种舆论的方式使学校取消录取资格 毕竟能干出这种事的一般是潜在犯罪嫌疑人 把这种人和正常学生放一块挺吓人的,4541038703948148,2,8,很多理智的网友都是希望以这种舆论的方式使学校取消录取资格 毕竟能干出这种事的一般是潜在犯罪嫌疑人 把这种人和正常学生放一块挺吓人的,6374997658,那是你的温柔LLL,https://weibo.com/u/6374997658,星之卡比,其他,f,29,197,2524,269,71,"2,733","3,073",
2,4541027509077562,1838632051,20年08月23日 10:40,给未来的室友一个警惕吧 毕竟你愿意和情绪容易激动喜欢使用暴力而且谎话连篇的人做室友吗 我想没有人愿意吧 真的倒霉分到一个宿舍了 还可以保护自己,4541034510685817,0,8,给未来的室友一个警惕吧 毕竟你愿意和情绪容易激动喜欢使用暴力而且谎话连篇的人做室友吗 我想没有人愿意吧 真的倒霉分到一个宿舍了 还可以保护自己,5955303538,Notworse-,https://weibo.com/u/5955303538,一个脾气暴躁的人。,江苏 南京,f,2872,814,372,"5,328",52,"12,831","18,211",
3,4541027509077562,1838632051,20年08月23日 10:45,"就是用舆论的压力让学校最后取消录取资格<img alt=""[微笑]"" title=""[微笑]"" src=""https://face.t.sinajs.cn/t4/appstyle/expression/ext/normal/e3/2018new_weixioa02_org.png"" />",4541035617982387,0,4,就是用舆论的压力让学校最后取消录取资格[微笑],2961629290,炒面炒粉本当上手,https://weibo.com/u/2961629290,翻篇翻不了啊也,其他,f,383,633,530,"1,884",6,"4,485","6,375",
4,4541027509077562,1838632051,20年08月23日 10:13,"你好，你感兴趣的“福州大学”已开通了超话社区～ 超话社区是微博旗下兴趣互动社区，快来与志同道合的小伙伴们一起交流互动吧！ 戳我进入&gt;&gt; <a target=""_blank"" href=""https://weibo.com/p/10080878cfd6712973070dbb9882dae03763b9""><img class=""icon-link"" title=""#福州大学[超话]#"" src=""https://h5.sinaimg.cn/upload/100/959/2020/05/09/timeline_card_small_super_default.png""/>福州大学超话</a>",4541027509869362,0,0,你好，你感兴趣的“福州大学”已开通了超话社区～ 超话社区是微博旗下兴趣互动社区，快来与志同道合的小伙伴们一起交流互动吧！ 戳我进入>> #福州大学[超话]#,5878659096,超话社区,https://weibo.com/u/5878659096,,北京,m,237743428,1720,27049,"2,912,007","5,990,621","57,353,772","66,256,400",超话社区官方微博
5,4541027509077562,1838632051,20年08月23日 10:28,因为有不要脸的营销号为了蹭热度买了热搜,4541031305183407,0,4,因为有不要脸的营销号为了蹭热度买了热搜,1696578887,柚是爱你的一天,https://weibo.com/u/1696578887,,其他,f,73,87,237,10,2,194,206,
6,4541027509077562,1838632051,20年08月23日 12:13,为他以后的老婆担心,4541057822624555,0,1,为他以后的老婆担心,5070457705,-Cerberus-,https://weibo.com/u/5070457705,500年没吃人肉了,辽宁 大连,m,88,193,17,28,14,12,54,
7,4541027509077562,1838632051,20年08月23日 11:41,因为这样施压学校才会重视，然后着手处理,4541049844014634,0,1,因为这样施压学校才会重视，然后着手处理,5015828174,Ken好运连连,https://weibo.com/u/5015828174,痴汉快走开😅好好学习，天天向上！,广东,m,246,1049,1228,107,9,257,373,
8,4541027509077562,1838632051,20年08月23日 10:24,福大实惨,4541030440896152,0,1,福大实惨,6203292420,灰森森森森林,https://weibo.com/u/6203292420,再来见我的时候记得给我带一束花，如果很急的话就帮我折枝花，如果没有的话准时赴约就好。,广东,f,378,1911,3329,"3,100",106,"16,096","19,302",
