,main_body_mid,main_body_uid,发布时间,处理内容,评论地点,mid,回复数量,点赞数量,原生内容,uid,用户昵称,用户主页,用户描述,用户地理位置,用户性别,用户粉丝数量,用户关注数量,用户全部微博,用户累计评论,用户累计转发,用户累计获赞,用户转评赞,用户认证信息
0,5046040300617960,2382064902,24年06月16日 23:54,小学还能被退学？？,来自山东,5046040619910202,37,76,小学还能被退学？？,2650258193,是你给我一片天2020,https://weibo.com/u/2650258193,曾获2006年时代周刊年度人物、2008年感动中国组委会特别大奖和2022年奥林匹克精神奖。,山东,m,387,2292,2504,173,125,414,712,
1,5046040300617960,2382064902,24年06月17日 08:23,大家特别要注意，这里面的差异全部都来自于所谓的“超前教育”。孩子有天赋，超前教育可以挖掘孩子的潜力并且把他送到一个高点。而我们舆论上特别注意塑造大家的“公平幻觉”，所以这个话题就提的很少。,来自上海,5046168669128595,11,101,大家特别要注意，这里面的差异全部都来自于所谓的“超前教育”。孩子有天赋，超前教育可以挖掘孩子的潜力并且把他送到一个高点。而我们舆论上特别注意塑造大家的“公平幻觉”，所以这个话题就提的很少。,2382064902,sven_shi,https://weibo.com/u/2382064902,希望自己每天都能变得更好。,上海 长宁区,m,1931512,986,38229,"3,364,151","3,505,232","17,557,225","24,426,608",互联网科技博主 V+优质创作者 2023微博年度新知博主
2,5046040300617960,2382064902,24年06月17日 00:09,这个朱朱其实更像学术界的谷爱琳。全世界都觉得谷爱琳是天才，其实谷燕才是天才，女儿的成就完全是站在父母肩膀上取得的。朱朱也是一样，父母为了凸显女儿的天才把自己的功劳完全隐藏了。但姜燕是100%靠自己，原生家庭没有助力只有拖累。,来自意大利,5046044234356311,15,180,这个朱朱其实更像学术界的谷爱琳。全世界都觉得谷爱琳是天才，其实谷燕才是天才，女儿的成就完全是站在父母肩膀上取得的。朱朱也是一样，父母为了凸显女儿的天才把自己的功劳完全隐藏了。但姜燕是100%靠自己，原生家庭没有助力只有拖累。,1097565313,VIXY已被禁关注LoveDavideDona,https://weibo.com/u/1097565313,2+2=5,上海 徐汇区,f,5307,1429,81779,"26,803","143,704","7,607","178,114",
3,5046040300617960,2382064902,24年06月16日 23:57,"因材施教和有教无类是互相矛盾的，因为因材施教要花很多钱<img alt=""[笑cry]"" title=""[笑cry]"" src=""https://face.t.sinajs.cn/t4/appstyle/expression/ext/normal/4a/2018new_xiaoku_thumb.png"" />",来自广东,5046041337136866,2,74,因材施教和有教无类是互相矛盾的，因为因材施教要花很多钱[笑cry],6992125319,aaa12235,https://weibo.com/u/6992125319,为女性权益战斗到底,其他,f,113,294,248,,,,,
4,5046040300617960,2382064902,24年06月16日 23:57,"其实美国大学参考种族、性别录取是有道理的。 每个阶层的资源不同，但人的智商情商都是正态分布。 不然都是只会刷题的华裔学生，<img alt=""[允悲]"" title=""[允悲]"" src=""https://face.t.sinajs.cn/t4/appstyle/expression/ext/normal/83/2018new_kuxiao_org.png"" />",来自日本,5046041187718554,24,28,其实美国大学参考种族、性别录取是有道理的。 每个阶层的资源不同，但人的智商情商都是正态分布。 不然都是只会刷题的华裔学生，[允悲],7721115933,爱上古川1,https://weibo.com/u/7721115933,,海外 日本,m,4730,1231,1603,"16,021","2,713","44,020","62,754",摄影博主
5,5046040300617960,2382064902,24年06月17日 00:38,国内本来就因为高考资源严重失衡。所以胃口堵这个嘴只能让普通人能接触到的贫瘠高考资源里给广大学子“高考对普通人最公平”这种“幻觉”。实际上“高考是对有天赋的人最公平”。目前“高考公平幻觉”到现在这高度，完全是体制内外收入差异持续扩大造成的。一个连“最低时薪”制度都没有的国家谈何公平,来自江西,5046051641492978,13,19,国内本来就因为高考资源严重失衡。所以胃口堵这个嘴只能让普通人能接触到的贫瘠高考资源里给广大学子“高考对普通人最公平”这种“幻觉”。实际上“高考是对有天赋的人最公平”。目前“高考公平幻觉”到现在这高度，完全是体制内外收入差异持续扩大造成的。一个连“最低时薪”制度都没有的国家谈何公平,7383283141,小伞行散,https://weibo.com/u/7383283141,喜欢看书,江西,m,114,222,142,32,4,86,122,
6,5046040300617960,2382064902,24年06月17日 01:19,不是请的牛津教授，她妈就是中科大少年班毕业的，她爸是教授。她自学加父母教的。,来自四川,5046061947422104,1,52,不是请的牛津教授，她妈就是中科大少年班毕业的，她爸是教授。她自学加父母教的。,1060140447,大黑山与清香坪,https://weibo.com/u/1060140447,,四川 攀枝花,m,713,1351,6688,"2,973","2,419",246,"5,638",
7,5046040300617960,2382064902,24年06月17日 00:06,"对，所以某人说自己被退学两年在家自学就很好笑。<img alt=""[喵喵]"" title=""[喵喵]"" src=""https://face.t.sinajs.cn/t4/appstyle/expression/ext/normal/7b/2018new_miaomiao_org.png"" />",来自广东,5046043534692946,0,28,对，所以某人说自己被退学两年在家自学就很好笑。[喵喵],7103257067,空间恋恋站,https://weibo.com/u/7103257067,,山东,f,7,540,8559,12,35,78,125,
8,5046040300617960,2382064902,24年06月16日 23:59,博主是牛津Kate朱朱,来自广东,5046041829444232,0,26,博主是牛津Kate朱朱,6829827137,非正常状态的WB,https://weibo.com/u/6829827137,,安徽,m,11,239,26,4,0,7,11,
9,5046040300617960,2382064902,24年06月17日 08:07,可是，我初中的时候，每天早上起来，我妈妈就给我把录音机按上，我一边洗漱吃饭，一边听英语课文的磁带，三年，从不间断，我初中英语基本上都是满分，奠定了英语的基础，高中住校了，没这听英语的条件，高考也有一百二十多分，这个方法，我个人觉得，是有用的，不在于留学，在于能助力。,来自重庆,5046164518603881,5,12,可是，我初中的时候，每天早上起来，我妈妈就给我把录音机按上，我一边洗漱吃饭，一边听英语课文的磁带，三年，从不间断，我初中英语基本上都是满分，奠定了英语的基础，高中住校了，没这听英语的条件，高考也有一百二十多分，这个方法，我个人觉得，是有用的，不在于留学，在于能助力。,2213136801,小肥牌胡豆瓣,https://weibo.com/u/2213136801,,重庆,f,263,508,3571,"2,133",202,336,"2,671",
10,5046040300617960,2382064902,24年06月17日 06:59,【非常客观】姜萍是属于运气特别好的那一类。她在中专里面遇到了一个愿意给她免费提供超前教育的数学老师。接着她的天赋才会被发掘，让她得奖被大家看见。,来自河南,5046147540583000,1,14,【非常客观】姜萍是属于运气特别好的那一类。她在中专里面遇到了一个愿意给她免费提供超前教育的数学老师。接着她的天赋才会被发掘，让她得奖被大家看见。,5893888039,京城青青,https://weibo.com/u/5893888039,原k12语文老师，高中语文教资持有者,北京,f,171017,639,3687,"14,497","111,736","121,071","247,304",微博原创视频博主 头条文章作者
11,5046040300617960,2382064902,24年06月17日 10:00,"<img alt=""[并不简单]"" title=""[并不简单]"" src=""https://face.t.sinajs.cn/t4/appstyle/expression/ext/normal/aa/2018new_bingbujiandan_org.png"" />唯一的问题是，5各学科竞赛，只有数学，“超前教育”是没啥用的。不会就是不会。",来自北京,5046193019423569,0,3,[并不简单]唯一的问题是，5各学科竞赛，只有数学，“超前教育”是没啥用的。不会就是不会。,1401659004,Zodzod_张浩,https://weibo.com/u/1401659004,凡所有相，皆是虚妄。若见诸相非相，则见如来。,北京 西城区,m,261192,9075,87280,"95,118","1,135,960","236,800","1,467,878",新浪微博 数据分析师 头条文章作者
12,5046040300617960,2382064902,24年06月17日 00:21,"因财施教<img alt=""[doge]"" title=""[doge]"" src=""https://face.t.sinajs.cn/t4/appstyle/expression/ext/normal/a1/2018new_doge02_org.png"" />",来自陕西,5046047374052777,0,7,因财施教[doge],2629680813,李大吉吉吉吉,https://weibo.com/u/2629680813,价值投机,四川 成都,m,388,808,616,111,18,215,344,
13,5046040300617960,2382064902,24年06月17日 08:04,作者太不了解牛津招生细节了，牛津面试题就是不需要高中以外知识就能做的，面试官是教授。当然不妨碍这些题目可以出很难。作者抓住这点不知道想说啥，人家就是15岁考了一下牛津进了数学面试而已。,来自广西,5046163715915777,2,10,作者太不了解牛津招生细节了，牛津面试题就是不需要高中以外知识就能做的，面试官是教授。当然不妨碍这些题目可以出很难。作者抓住这点不知道想说啥，人家就是15岁考了一下牛津进了数学面试而已。,2024066795,Zonderland24,https://weibo.com/u/2024066795,,上海 卢湾区,m,1161,758,12254,"8,483","4,147",485,"13,115",
14,5046040300617960,2382064902,24年06月17日 00:18,父母的水平就是孩子的起跑线,来自湖南,5046046574510149,0,6,父母的水平就是孩子的起跑线,5619423821,清枫無恨0o0,https://weibo.com/u/5619423821,立志成为土木工程的叛忍（已获注册岩土/结构）,北京 朝阳区,m,31,99,1677,8,5,42,55,
15,5046040300617960,2382064902,24年06月17日 01:23,另外张雪峰看孩子家庭条件给人选路线，某情感博主也是看咨询的人的脸来给咨询人情感上建议的。,来自上海,5046062848935147,0,7,另外张雪峰看孩子家庭条件给人选路线，某情感博主也是看咨询的人的脸来给咨询人情感上建议的。,1678455043,张志航,https://weibo.com/u/1678455043,朋友们，我是张志航，在游戏市场需要帮忙？有事要托人问问？也或者你心里不舒服想找人聊聊？那你都可以来找我。,上海 宝山区,m,440,799,497,463,"1,064",61,"1,588",上海伊灵文化传播有限公司董事副总经理
16,5046040300617960,2382064902,24年06月17日 09:25,是的，我们普通人看到的是有能力的家长送孩子上更好的学校，其实更有能力的家长是不让孩子上义务教务浪费时间，在家请大师级的老师教，还有个前提是人爸妈就给营造了一个良好的成长环境，某种程度上的资源互换，这可不只是单纯有钱,来自浙江,5046184237072562,0,3,是的，我们普通人看到的是有能力的家长送孩子上更好的学校，其实更有能力的家长是不让孩子上义务教务浪费时间，在家请大师级的老师教，还有个前提是人爸妈就给营造了一个良好的成长环境，某种程度上的资源互换，这可不只是单纯有钱,1937337584,buludugupu,https://weibo.com/u/1937337584,,其他,f,138,543,1510,184,35,860,"1,079",
17,5046040300617960,2382064902,24年06月17日 08:08,"<img alt=""[泪]"" title=""[泪]"" src=""https://face.t.sinajs.cn/t4/appstyle/expression/ext/normal/6e/2018new_leimu_org.png"" />感谢斯文安慰，我成绩不好是因为没有好的教育资源，不是因为我笨",来自广东,5046164803553724,1,4,[泪]感谢斯文安慰，我成绩不好是因为没有好的教育资源，不是因为我笨,1948895660,吃货蒋,https://weibo.com/u/1948895660,面瘫的脸孔下隐藏的是一个影帝的灵魂,广东 深圳,m,100,256,1195,929,300,168,"1,397",
18,5046040300617960,2382064902,24年06月17日 07:54,而且人家是面试数学系做题…啥请牛津教授做题…,来自上海,5046161335387219,0,5,而且人家是面试数学系做题…啥请牛津教授做题…,7414280563,Swssee,https://weibo.com/u/7414280563,,其他,m,12,419,2056,37,180,936,"1,153",
19,5046040300617960,2382064902,24年06月17日 01:30,高考让我知道，教育从来不是公平的,来自山东,5046064611067880,0,3,高考让我知道，教育从来不是公平的,1222873452,卡拉绵羊,https://weibo.com/u/1222873452,报告特蕾西娅，今天也没有推进源石计划。 报告普瑞赛斯，今天也没有放弃源石计划。 报告坎诺特，今天也是压左边allallall。,海外 英国,m,80,442,3717,604,62,"3,060","3,726",
20,5046040300617960,2382064902,24年06月16日 23:58,这个博主15岁时候应该是已经高中毕业了，去面试的国外大学,来自广东,5046041407391964,0,6,这个博主15岁时候应该是已经高中毕业了，去面试的国外大学,6829827137,非正常状态的WB,https://weibo.com/u/6829827137,,安徽,m,11,239,26,4,0,7,11,
21,5046040300617960,2382064902,24年06月17日 13:14,普通学生没有初中学籍没法考高中，我这里跨区都不行,来自山东,5046241786598047,1,2,普通学生没有初中学籍没法考高中，我这里跨区都不行,1474708773,鹿鸣蓁蓁cc,https://weibo.com/u/1474708773,无,其他,f,3512,843,13802,"57,125","4,407","42,322","103,854",
22,5046040300617960,2382064902,24年06月17日 09:18,恶臭的精英主义只关注效率能力和结果，所以崇拜工具理性，培养冷血自大的利己主义者，这套逻辑和绩效考核的负作用同理,来自吉林,5046182520292927,0,2,恶臭的精英主义只关注效率能力和结果，所以崇拜工具理性，培养冷血自大的利己主义者，这套逻辑和绩效考核的负作用同理,5645487662,水母酱blue,https://weibo.com/u/5645487662,vov,其他,f,265,3894,2250,188,40,506,734,
23,5046040300617960,2382064902,24年06月18日 06:19,牛津朱朱家里条件是好，但她小学退学也可能是有叛逆期。她数学应该是有部分天赋，再加上家里教的。,来自江苏,5046499664461998,1,0,牛津朱朱家里条件是好，但她小学退学也可能是有叛逆期。她数学应该是有部分天赋，再加上家里教的。,2874953080,kato1997,https://weibo.com/u/2874953080,,江苏 南京,m,585,774,8056,57,113,222,392,
24,5046040300617960,2382064902,24年06月17日 17:41,软实力决定硬实力,来自北京,5046309125886033,0,1,软实力决定硬实力,1401161464,幸运的安東尼,https://weibo.com/u/1401161464,人生只是一场体验，谁都无法永远占有。总有一天，我们都会和曾经拥有的一切永别，坦然面对经历的一切。,北京,m,249,176,132,4,4,9,17,
25,5046040300617960,2382064902,24年06月17日 11:18,"输在起点比输在终点好<img alt=""[doge]"" title=""[doge]"" src=""https://face.t.sinajs.cn/t4/appstyle/expression/ext/normal/a1/2018new_doge02_org.png"" />",来自湖北,5046212610229850,1,0,输在起点比输在终点好[doge],5928210729,常悅同学,https://weibo.com/u/5928210729,空缱绻，说风流,其他,m,81,190,1027,60,18,86,164,
26,5046040300617960,2382064902,24年06月17日 11:13,超前教育是由父母决定的。,来自辽宁,5046211323890687,0,1,超前教育是由父母决定的。,2683674851,偶像派纳税人,https://weibo.com/u/2683674851,幽默是弱者的反抗。,辽宁 大连,m,123,167,1324,55,26,114,195,
27,5046040300617960,2382064902,24年06月17日 00:40,"都是卖人设的<img alt=""[黑线]"" title=""[黑线]"" src=""https://face.t.sinajs.cn/t4/appstyle/expression/ext/normal/a3/2018new_heixian_org.png"" />",来自贵州,5046052190945319,0,2,都是卖人设的[黑线],1677588353,JasonIcy,https://weibo.com/u/1677588353,❤、将来的你一定会感谢现在拼命努力的你。,湖北 武汉,m,1376,2039,11206,"9,204",761,700,"10,665",
28,5046040300617960,2382064902,24年06月17日 17:54,是的，我第一眼看到这个新闻的时候就在想，她家里要是条件好又会是怎么样的发展,来自福建,5046312363363564,0,0,是的，我第一眼看到这个新闻的时候就在想，她家里要是条件好又会是怎么样的发展,7313655319,oeRi-T3T,https://weibo.com/u/7313655319,,广东 广州,f,19,201,112,72,9,181,262,
29,5046040300617960,2382064902,24年06月17日 15:51,图里这个人她妈就是中科院少年班的天才 数学博士,来自上海,5046281308737505,0,0,图里这个人她妈就是中科院少年班的天才 数学博士,2968571564,虹口渣渣菲,https://weibo.com/u/2968571564,Care to get some amusement?,黑龙江,f,131,541,973,192,50,363,605,
30,5046040300617960,2382064902,24年06月17日 12:48,大家没有一样的路，也从来不在一个起跑线上,来自上海,5046235269170325,0,1,大家没有一样的路，也从来不在一个起跑线上,7768188624,间接性戒多巴胺,https://weibo.com/u/7768188624,,北京,m,7,209,22,9,0,44,53,
31,5046040300617960,2382064902,24年07月03日 16:22,第一个被常春藤录取的故事可信度非常低，现在是2024年，不是1994年，致力于爬藤的家长怎么可能去相信这种低级的谎言?,来自上海,5052087337225546,0,1,第一个被常春藤录取的故事可信度非常低，现在是2024年，不是1994年，致力于爬藤的家长怎么可能去相信这种低级的谎言?,1772133250,阳光的美宝妈,https://weibo.com/u/1772133250,六岁哈士奇MM的麻麻,上海 浦东新区,f,591,2230,916,281,233,138,652,
32,5046040300617960,2382064902,24年11月03日 23:47,"挖坟了<img alt=""[偷笑]"" title=""[偷笑]"" src=""https://face.t.sinajs.cn/t4/appstyle/expression/ext/normal/71/2018new_touxiao_org.png"" />",来自云南,5096773137205702,0,0,挖坟了[偷笑],7804578824,瑞士村威尔逊爱德华兹,https://weibo.com/u/7804578824,,其他,m,12,220,42,8,1,6,15,
33,5046040300617960,2382064902,24年07月04日 08:38,"看哪个成功人士说的，自己3岁开始自学英语<img alt=""[doge]"" title=""[doge]"" src=""https://face.t.sinajs.cn/t4/appstyle/expression/ext/normal/a1/2018new_doge02_org.png"" />",来自上海,5052332945704942,0,0,看哪个成功人士说的，自己3岁开始自学英语[doge],1709033452,巴普洛夫的汪汪对,https://weibo.com/u/1709033452,冷漠本无意寂寥亦非情,其他,m,712,4266,16375,263,172,414,849,
34,5046040300617960,2382064902,24年06月17日 19:48,知乎水平,来自浙江,5046341040605837,0,0,知乎水平,1600503477,我不叫小梁,https://weibo.com/u/1600503477,偶尔写点bug,广东 中山,m,720,733,2141,"1,755",510,412,"2,677",
35,5046040300617960,2382064902,24年06月17日 10:34,"绝大部分人都是天赋平平，在这扯毛的超前<img alt=""[二哈]"" title=""[二哈]"" src=""https://face.t.sinajs.cn/t4/appstyle/expression/ext/normal/22/2018new_erha_org.png"" />",来自广西,5046201495849702,0,0,绝大部分人都是天赋平平，在这扯毛的超前[二哈],5505801755,事情不是你想的那样--,https://weibo.com/u/5505801755,……,其他,m,2,283,1550,8,26,161,195,
36,5046040300617960,2382064902,24年06月17日 10:26,“和。。。教授做题”这句话怎么理解？,来自上海,5046199532393399,0,0,“和。。。教授做题”这句话怎么理解？,7076911696,中年胖子2019,https://weibo.com/u/7076911696,Hardship is part of the path,其他,m,22,113,56,3,0,18,21,
37,5046040300617960,2382064902,24年06月17日 08:52,其实都是个案，只不过有想复制的就有市场，就有人想帮人总结规律、照方抓药来谋利，毕竟总要有个努力的方向，也叫人生的“奔头”。但很多东西真的是命，父母有很好的资源和财富当然机会更好，但并不保证成功，这也给了寒门逆袭的机会，但需要在希望渺茫的情况下付出更多的努力，总有人会搏一搏的。,来自天津,5046175905874501,0,0,其实都是个案，只不过有想复制的就有市场，就有人想帮人总结规律、照方抓药来谋利，毕竟总要有个努力的方向，也叫人生的“奔头”。但很多东西真的是命，父母有很好的资源和财富当然机会更好，但并不保证成功，这也给了寒门逆袭的机会，但需要在希望渺茫的情况下付出更多的努力，总有人会搏一搏的。,1896298835,azuretulip,https://weibo.com/u/1896298835,YNWA&RUN AS ONE💪,天津,m,788,312,16667,"10,998","6,164","3,022","20,184",
38,5046040300617960,2382064902,24年06月17日 08:05,现在的中小学教育就是浪费时间，为了所谓的教育公平，武大郎买办，内外联动驱逐英才，逼着留学。留学又不会让你学到东西，只是权贵的一扇窗,来自河南,5046164020004798,0,1,现在的中小学教育就是浪费时间，为了所谓的教育公平，武大郎买办，内外联动驱逐英才，逼着留学。留学又不会让你学到东西，只是权贵的一扇窗,2462527833,bp时代,https://weibo.com/u/2462527833,爱生活，爱美女，爱美食，爱美景更爱人民币,河南 洛阳,m,176,167,1336,353,68,496,917,
39,5046040300617960,2382064902,24年06月17日 06:23,"<img alt=""[苦涩]"" title=""[苦涩]"" src=""https://face.t.sinajs.cn/t4/appstyle/expression/ext/normal/7e/2021_bitter_org.png"" /><img alt=""[苦涩]"" title=""[苦涩]"" src=""https://face.t.sinajs.cn/t4/appstyle/expression/ext/normal/7e/2021_bitter_org.png"" />",来自辽宁,5046138409582878,0,0,[苦涩][苦涩],5532545291,木凡Doctor,https://weibo.com/u/5532545291,生活不仅仅有眼前的苟且， 还有诗和远方。,辽宁 沈阳,m,6662,358,82,58,0,83,141,
40,5046040300617960,2382064902,24年06月17日 02:57,是这样的，超前教育。有天赋的不少，真正有能力去培养天赋的又有几个呢？普通人有这眼界有这精力有这财力去培养吗？,来自江西,5046086504809641,0,3,是这样的，超前教育。有天赋的不少，真正有能力去培养天赋的又有几个呢？普通人有这眼界有这精力有这财力去培养吗？,7612844749,Siseulement_,https://weibo.com/u/7612844749,一体机色批一个，专注自己，不信任何人,其他,m,34,143,9780,776,369,"3,137","4,282",
41,5046040300617960,2382064902,24年06月17日 02:35,转发微博,来自宁夏,5046080964919600,0,0,转发微博,7120271978,净7静,https://weibo.com/u/7120271978,菜全无。知者减半，省者全无 🙏₂₀³⁶。洗心：n年前没有在因上努力，n年后就没有资格在果上执着。不多话、不批评、不抱怨、不添麻烦、不闹矛盾。,其他,f,78,58,3436,155,21,131,307,
42,5046040300617960,2382064902,24年06月17日 00:05,"<img alt=""[吃瓜]"" title=""[吃瓜]"" src=""https://face.t.sinajs.cn/t4/appstyle/expression/ext/normal/01/2018new_chigua_org.png"" /><img alt=""[吃瓜]"" title=""[吃瓜]"" src=""https://face.t.sinajs.cn/t4/appstyle/expression/ext/normal/01/2018new_chigua_org.png"" /><img alt=""[吃瓜]"" title=""[吃瓜]"" src=""https://face.t.sinajs.cn/t4/appstyle/expression/ext/normal/01/2018new_chigua_org.png"" />",来自广东,5046043190761830,0,0,[吃瓜][吃瓜][吃瓜],2015054527,总是忘记用户名的小宅,https://weibo.com/u/2015054527,,广东 深圳,f,293,914,4635,368,682,83,"1,133",
43,5046040300617960,2382064902,24年06月17日 00:03,付费流量和免费流量,来自意大利,5046042729383928,0,0,付费流量和免费流量,1097565313,VIXY已被禁关注LoveDavideDona,https://weibo.com/u/1097565313,2+2=5,上海 徐汇区,f,5307,1429,81779,"26,803","143,704","7,607","178,114",
44,5046040300617960,2382064902,24年06月17日 11:18,看了原本想说更关注超前教育者后续的发展，就和中科大少年班似得，心力有限，如何不被过度消耗---又觉得想多了，看在更多的是专注和勤奋不够，远不到心力被过度消耗的地步,来自北京,5046212724525665,0,0,看了原本想说更关注超前教育者后续的发展，就和中科大少年班似得，心力有限，如何不被过度消耗---又觉得想多了，看在更多的是专注和勤奋不够，远不到心力被过度消耗的地步,2692008324,兔女郎四人帮,https://weibo.com/u/2692008324,大辩若讷,北京 东城区,f,4949,419,7791,"5,379","9,969","4,928","20,276",互联网工程师
45,5046040300617960,2382064902,24年06月20日 11:34,截图这位是牛津数学系的朱朱，应该用“她”不是他,来自上海,5047303772046214,0,0,截图这位是牛津数学系的朱朱，应该用“她”不是他,1292007700,守望那片海1216,https://weibo.com/u/1292007700,已婚已育已有猫,其他,f,259,257,56233,"24,356","40,261","11,521","76,138",萌宠博主
46,5046040300617960,2382064902,24年06月18日 23:57,"扎心了<img alt=""[单身狗]"" title=""[单身狗]"" src=""https://face.t.sinajs.cn/t4/appstyle/expression/ext/normal/20/2021_alongdog_org.png"" />",来自天津,5046765969478386,0,0,扎心了[单身狗],1737812393,手动控_,https://weibo.com/u/1737812393,save myself,海外 澳大利亚,m,1685,133,17983,"2,072","1,685",751,"4,508",
47,5046040300617960,2382064902,24年06月17日 07:08,嗯,来自北京,5046149711136548,0,0,嗯,2450229703,卿倾浅夏,https://weibo.com/u/2450229703,不温柔，不虚荣，不做作，不喝酒，不高调，懂人事，听人话，办人事，爱燕姿。,北京,f,883,509,12927,"5,213","1,862","1,575","8,650",
48,5046040300617960,2382064902,24年06月17日 06:27,所以是千里马常有而伯乐不常有,来自云南,5046139414119795,0,0,所以是千里马常有而伯乐不常有,6606496518,beiji1015,https://weibo.com/u/6606496518,,其他,m,12,217,27,1,0,15,16,
