,main_body_mid,main_body_uid,发布时间,处理内容,评论地点,mid,回复数量,点赞数量,原生内容,uid,用户昵称,用户主页,用户描述,用户地理位置,用户性别,用户粉丝数量,用户关注数量,用户全部微博,用户累计评论,用户累计转发,用户累计获赞,用户转评赞,用户认证信息
49,5046040300617960,2382064902,24年06月17日 06:21,典型的公知文，这味不要太冲，记者的儿子怎么也不可能条件太差，你说是山里面的孩子这么做我还信，因为别人是真穷,来自四川,5046137850953786,0,0,典型的公知文，这味不要太冲，记者的儿子怎么也不可能条件太差，你说是山里面的孩子这么做我还信，因为别人是真穷,1804140012,呼唤爱的野兽,https://weibo.com/u/1804140012,曾经是个笑话，笑话仍在持续中,四川 成都,m,24,16,168,20,9,26,55,
50,5046040300617960,2382064902,24年06月17日 05:57,她说和牛津教授做题的那个事情，是去牛津面试的事。牛津剑桥面试的时候，都是教授给你不停的出题目，几个小时一直做题。并不是找牛津教授辅导或者拉关系。,来自浙江,5046131765543909,1,12,她说和牛津教授做题的那个事情，是去牛津面试的事。牛津剑桥面试的时候，都是教授给你不停的出题目，几个小时一直做题。并不是找牛津教授辅导或者拉关系。,1512127712,都市研究,https://weibo.com/u/1512127712,小舟从此逝，江海寄余生,北京 东城区,m,1006,1439,43003,"1,371","9,268","3,938","14,577",
51,5046040300617960,2382064902,24年06月17日 07:20,"人家的起跑线是我的终点<img alt=""[二哈]"" title=""[二哈]"" src=""https://face.t.sinajs.cn/t4/appstyle/expression/ext/normal/22/2018new_erha_org.png"" />",来自上海,5046152752007670,0,2,人家的起跑线是我的终点[二哈],7868507540,PPX小浣熊贰代,https://weibo.com/u/7868507540,世间一切法，无非求心安,其他,f,10,181,112,12,1,5,18,
52,5046040300617960,2382064902,24年09月10日 12:54,"<a href=/n/六太白 usercard=""name=@六太白"">@六太白</a>",来自四川,5077039869332155,0,0,@六太白,6462607891,西江晓月与苍澜,https://weibo.com/u/6462607891,地球旅客,其他,f,26,29,619,133,6,97,236,
53,5046040300617960,2382064902,24年06月17日 14:48,教育领域的高屋建瓴,来自四川,5046265408653150,0,0,教育领域的高屋建瓴,5519490098,不语56448,https://weibo.com/u/5519490098,,其他,m,2,8,8,0,2,4,6,
54,5046040300617960,2382064902,24年06月17日 10:06,"幸亏如今天下大乱，互联网产品又超前发展，不然这些信息很难得到//<a href=/n/sven_shi usercard=""name=@sven_shi"">@sven_shi</a>:大家特别要注意，这里面的差异全部都来自于所谓的“超前教育”。孩子有天赋，超前教育可以挖掘孩子的潜力并且把他送到一个高点。而我们舆论上特别注意塑造大家的“公平幻觉”，所以这个话题就提的很少。",来自浙江,5046194613782184,0,0,幸亏如今天下大乱，互联网产品又超前发展，不然这些信息很难得到//@sven_shi:大家特别要注意，这里面的差异全部都来自于所谓的“超前教育”。孩子有天赋，超前教育可以挖掘孩子的潜力并且把他送到一个高点。而我们舆论上特别注意塑造大家的“公平幻觉”，所以这个话题就提的很少。,5971168249,奥肚鹰,https://weibo.com/u/5971168249,到乙游这来爆炒臊鸡,其他,m,33,9,2907,598,598,534,"1,730",
55,5046040300617960,2382064902,24年06月17日 06:30,其他不可信，一般情况父母的水平才是孩子的起跑线。,来自北京,5046140276310944,0,0,其他不可信，一般情况父母的水平才是孩子的起跑线。,2671774577,蔻蔻奶奶,https://weibo.com/u/2671774577,,北京 丰台区,f,129,45,4778,664,62,"1,154","1,880",
56,5046040300617960,2382064902,24年06月17日 01:07,当中就有人问他怎么读书，特别是怎么学英语。他讲了一个磁带和坏掉的录音机的故事。以前英语教材是发磁带的。听英语就需要倒带。他的录音机就坏了不能倒带，所以他就要用笔去卷磁带听。----------非常明显的谎言,来自广东,5046058855956661,1,4,当中就有人问他怎么读书，特别是怎么学英语。他讲了一个磁带和坏掉的录音机的故事。以前英语教材是发磁带的。听英语就需要倒带。他的录音机就坏了不能倒带，所以他就要用笔去卷磁带听。----------非常明显的谎言,1428280397,肤爽宠物水疗液,https://weibo.com/u/1428280397,肤爽宠物水疗液：纯中药成分，猫狗浴后可用，除臭、护毛护肤效果佳。,广东 广州,m,2928,2451,62100,"11,545","41,672","6,952","60,169",
57,5046040300617960,2382064902,24年06月17日 00:40,只讲人们爱听的话，不讲真正让你成功的原因。,来自广东,5046052166569231,0,4,只讲人们爱听的话，不讲真正让你成功的原因。,7721623296,佳言413,https://weibo.com/u/7721623296,,其他,f,1,103,6,1,0,1,2,
58,5046040300617960,2382064902,24年06月17日 00:01,转发微博,来自重庆,5046042286363722,0,0,转发微博,7918578793,昊宏看世界,https://weibo.com/u/7918578793,苟利国家生死以，岂因祸福避趋之！,其他,m,5,283,1121,8,17,105,130,
59,5046040300617960,2382064902,24年06月17日 07:52,小学被退学，正常情况只有一种可能，就是被他爸妈退学，学校是万不会给他退学的,来自浙江,5046160845177166,0,1,小学被退学，正常情况只有一种可能，就是被他爸妈退学，学校是万不会给他退学的,5240326337,悟空不悟111,https://weibo.com/u/5240326337,,浙江 杭州,m,11,277,33,4,1,14,19,
60,5046040300617960,2382064902,24年06月17日 07:30,别人吹牛逼你也信。,来自安徽,5046155320493480,0,0,别人吹牛逼你也信。,6393348110,豆沙不喜欢吃鱼,https://weibo.com/u/6393348110,暗夜沙罗莫名炸号,其他,m,34,594,41,17,5,38,60,
61,5046040300617960,2382064902,24年06月17日 00:13,666,来自陕西,5046045222371824,0,0,666,7925558879,志愿者Q,https://weibo.com/u/7925558879,,其他,m,7,963,19,4,0,13,17,
