,comments_level_1_mid,main_body_uid,发布时间,处理内容,评论地点,mid,点赞数量,原生内容,uid,用户昵称,用户主页,用户描述,用户地理位置,用户性别,用户粉丝数量,用户关注数量,用户全部微博,用户累计评论,用户累计转发,用户累计获赞,用户转评赞
0,5037331891623731,1791058743,24年05月24日 09:00,是不想事情闹大吧，只是没想到闹得更大了,来自福建,5037480593589529,13,是不想事情闹大吧，只是没想到闹得更大了,5648699816,Vionowy,https://weibo.com/u/5648699816,,湖北,m,11,370,491,25,8,226,259
1,5037331891623731,1791058743,24年05月24日 12:58,班主任和辅导员都别说这样的事情了，哪怕是学生受到处分你今年的奖金什么的都会少甚至某项考核的奖金都没了,来自湖北,5037540552477932,3,班主任和辅导员都别说这样的事情了，哪怕是学生受到处分你今年的奖金什么的都会少甚至某项考核的奖金都没了,7484396147,再看一眼晚霞就去晚自习,https://weibo.com/u/7484396147,记录生活啦,湖北,m,788,12,231,687,"2,134","6,289","9,110"
2,5037331891623731,1791058743,24年05月25日 01:59,法治建设，任重而道远。明显辅导员不把猥亵当回事。,来自浙江,5037737019442717,3,法治建设，任重而道远。明显辅导员不把猥亵当回事。,1761814665,十三IN,https://weibo.com/u/1761814665,,山东 济南,m,40,22,44,60,64,1,125
3,5037331891623731,1791058743,24年05月25日 12:03,不管是学校，企业，政府，出了什么事，第一反应就是把事情盖住，他们优先考虑的是对外的影响，而不是受害人,来自福建,5037888989303331,0,不管是学校，企业，政府，出了什么事，第一反应就是把事情盖住，他们优先考虑的是对外的影响，而不是受害人,2954873775,面包树皮九,https://weibo.com/u/2954873775,,福建 三明,m,496,337,396,33,5,37,75
4,5037331891623731,1791058743,24年05月24日 08:23,所以说啊，事件真实性有待考究,来自安徽,5037471371364420,0,所以说啊，事件真实性有待考究,7848369819,用户7848369819,https://weibo.com/u/7848369819,,其他,m,0,32,0,0,0,0,0
5,5037331891623731,1791058743,24年05月24日 14:08,"回复<a href=/n/用户7848369819 usercard=""name=@用户7848369819"">@用户7848369819</a>:胖猫的事我直接冲锋，女的被猥亵我说让子弹飞一会，呜呜呜对不起我是小仙男爱吃性别红利喜欢让我的兄弟们替我冲锋",来自北京,5037558153352030,10,回复@用户7848369819:胖猫的事我直接冲锋，女的被猥亵我说让子弹飞一会，呜呜呜对不起我是小仙男爱吃性别红利喜欢让我的兄弟们替我冲锋,7754462420,RAINBOWL531,https://weibo.com/u/7754462420,东亚文科女,黑龙江,f,8,109,180,164,0,142,306
